eslint/eslint,10269,mickaelchanrion,Fix: Junit formatter handles better warnings/errors (fixes #10266),https://github.com/eslint/eslint/pull/10269
eslint/eslint,10267,mickaelchanrion,Fix: Junit formatter handles better warnings/errors (fixes #10266),https://github.com/eslint/eslint/pull/10267
eslint/eslint,10235,stevenvachon,Fine grain `one-var` config,https://github.com/eslint/eslint/pull/10235
eslint/eslint,10231,stevenvachon,Support for more detail in `one-var`,https://github.com/eslint/eslint/pull/10231
eslint/eslint,10224,romainwn,fix typo,https://github.com/eslint/eslint/pull/10224
eslint/eslint,10166,aladdin-add,wip: Fix: throw an error when disable a non-existent rule (fixes #9505),https://github.com/eslint/eslint/pull/10166
eslint/eslint,10165,aladdin-add,wip: Update: allow custom styleguide when init (fixes #10132),https://github.com/eslint/eslint/pull/10165
eslint/eslint,10164,aladdin-add,Fix: rm unnecessary /i in config-validator,https://github.com/eslint/eslint/pull/10164
eslint/eslint,10153,epoberezkin,Update ajv to the latest version,https://github.com/eslint/eslint/pull/10153
eslint/eslint,10133,edahlseng,Update: Fallback to no prefix when searching for eslint-config modules,https://github.com/eslint/eslint/pull/10133
eslint/eslint,10126,NMinhNguyen,Fix: `no-unused-vars` false positive on default params (fixes #10124),https://github.com/eslint/eslint/pull/10126
eslint/eslint,10087,safaiyeh,Docs: Updated no-nested-ternary.md, simplified code of the correct example,https://github.com/eslint/eslint/pull/10087
eslint/eslint,10079,hulkish,Replaced babel-code-frame with @babel/code-frame, enabled highlightCode,https://github.com/eslint/eslint/pull/10079
eslint/eslint,10058,jaydenseric,Update: Add mjs to --ext default (fixes #9592),https://github.com/eslint/eslint/pull/10058
eslint/eslint,10056,steabert,Fix: silently skip non-existing files (fixes #10039),https://github.com/eslint/eslint/pull/10056
eslint/eslint,10032,not-an-aardvark,Chore: improve autofix performance (fixes #9998),https://github.com/eslint/eslint/pull/10032
eslint/eslint,10018,blake-regalia,Update: Add option `"maxConcat"` to `prefer-template` rule (fixes #10017),https://github.com/eslint/eslint/pull/10018
eslint/eslint,10016,blake-regalia,Update: Allow for no lines around comments before else (fixes #10015),https://github.com/eslint/eslint/pull/10016
eslint/eslint,9989,pvdlg,Docs: Add prefer-destructuring examples (fixes #9970),https://github.com/eslint/eslint/pull/9989
eslint/eslint,9982,PenelopeFudd,Docs: Update no-func-assign.md,https://github.com/eslint/eslint/pull/9982
eslint/eslint,9979,germanz,Fix: valid-jsdoc failure for missing return in interface methods (fixes #9978),https://github.com/eslint/eslint/pull/9979
eslint/eslint,9935,caub,Chore: Use json5 for parsing json configs,https://github.com/eslint/eslint/pull/9935
eslint/eslint,9902,betaorbust,Breaking: Rule Tester strictly checks messageId and data. (fixes #9890),https://github.com/eslint/eslint/pull/9902
eslint/eslint,9896,ngotchac,Fix: Module resolution (fixes #9897),https://github.com/eslint/eslint/pull/9896
eslint/eslint,9871,ppatotski,Enabled accessing 'data' for processors.,https://github.com/eslint/eslint/pull/9871
eslint/eslint,9865,doodadjs,Fix: Add exceptions (refs #9233),https://github.com/eslint/eslint/pull/9865
eslint/eslint,9864,maciej-ka,New: Option to use yarn in init wizard (#9863),https://github.com/eslint/eslint/pull/9864
eslint/eslint,9860,wmertens,Fix: no-shadow-restricted-names catch {} crash,https://github.com/eslint/eslint/pull/9860
eslint/eslint,9840,pmcelhaney,Update: use meta.docs.url in HTML formatter,https://github.com/eslint/eslint/pull/9840
eslint/eslint,9826,IanSavchenko,Update: Brace style for `import` statements,https://github.com/eslint/eslint/pull/9826
eslint/eslint,9823,j-f1,Update: Restrict re-exports in no-restricted-imports,https://github.com/eslint/eslint/pull/9823
eslint/eslint,9814,silvenon,Chore: Update GitHub PR template,https://github.com/eslint/eslint/pull/9814
eslint/eslint,9809,gyandeeps,Breaking: Upgrade minimum nodejs version to 6,https://github.com/eslint/eslint/pull/9809
eslint/eslint,9772,kala888,target could be undefined in Webstorm,https://github.com/eslint/eslint/pull/9772
eslint/eslint,9748,rwjblue,Fix: Allow project relative globs in overrides config (fixes #9740),https://github.com/eslint/eslint/pull/9748
eslint/eslint,9736,tawanjairew,Pr/release make file tests,https://github.com/eslint/eslint/pull/9736
eslint/eslint,9714,Mardak,New: Allow optional syntax sort groups for sort-imports (fixes #9713),https://github.com/eslint/eslint/pull/9714
eslint/eslint,9704,vcanales,Fix: directives on multiline comments prefixed with `*` (Fixes #9646),https://github.com/eslint/eslint/pull/9704
eslint/eslint,9689,TravisBuddy,TravisBuddy Integration,https://github.com/eslint/eslint/pull/9689
eslint/eslint,9684,coreyfarrell,Update: Add exceptions option to camelcase.,https://github.com/eslint/eslint/pull/9684
eslint/eslint,9676,jr-grenoble,New: Banner style (was issue 9361),https://github.com/eslint/eslint/pull/9676
eslint/eslint,9671,j-f1,New: Autofix some one-var reports,https://github.com/eslint/eslint/pull/9671
eslint/eslint,9659,chocolateboy,Docs: Add missing word,https://github.com/eslint/eslint/pull/9659
eslint/eslint,9651,cmswalker,Update: added option to enforce immutables for prefer-const,https://github.com/eslint/eslint/pull/9651
eslint/eslint,9644,hotforfeature,New: add "multiline" option to padding-line-between-statements (#9642),https://github.com/eslint/eslint/pull/9644
eslint/eslint,9636,devsnek,add bigint type to valid-typeof,https://github.com/eslint/eslint/pull/9636
eslint/eslint,9630,KagamiChan,fix `Cannot read property 'match' of undefined` error,https://github.com/eslint/eslint/pull/9630
eslint/eslint,9627,aladdin-add,WIP: Update: align argument for indent VariableDeclarator(fixes #8976),https://github.com/eslint/eslint/pull/9627
eslint/eslint,9623,sharmilajesupaul,Update: nonblock-statement-body-position: add arrow fns (Refs: #9510),https://github.com/eslint/eslint/pull/9623
eslint/eslint,9616,aladdin-add,Chore: upgrade doctrine@2.0.1,https://github.com/eslint/eslint/pull/9616
eslint/eslint,9613,kesne,Update no-shadow-restricted-names to handle optional catch,https://github.com/eslint/eslint/pull/9613
eslint/eslint,9606,Asgator,Update no-octal-escape.js (Cannot read property 'match' of undefined),https://github.com/eslint/eslint/pull/9606
eslint/eslint,9581,jrpool,New: Add object options to object-property-newline for JSCS.,https://github.com/eslint/eslint/pull/9581
eslint/eslint,9563,morgs32,Apply object-property-newline to destructuring and imports,https://github.com/eslint/eslint/pull/9563
eslint/eslint,9555,jonkeller,Upgrade: globals to 10.2.0,https://github.com/eslint/eslint/pull/9555
eslint/eslint,9554,jonkeller,Upgrade globals to newest version,https://github.com/eslint/eslint/pull/9554
eslint/eslint,9522,jrpool,New: Revise rule object-property-newline, tests, and docs (refs #6251),https://github.com/eslint/eslint/pull/9522
eslint/eslint,9508,aladdin-add,Build: test more eslint-plugin-* before release (refs #9334),https://github.com/eslint/eslint/pull/9508
eslint/eslint,9499,aladdin-add,Chore: upgrade sinon@4.0.1 to fix ci.,https://github.com/eslint/eslint/pull/9499
eslint/eslint,9489,gpiress,Docs: multiline-comment valid block separate-lines,https://github.com/eslint/eslint/pull/9489
eslint/eslint,9487,gpiress,Fix: multiline-comment-style autofix (fixes #9485),https://github.com/eslint/eslint/pull/9487
eslint/eslint,9465,BenoitZugmeyer,Update: add "always" option to no-sequences,https://github.com/eslint/eslint/pull/9465
eslint/eslint,9460,aladdin-add,Build: babel-preset-es2015 => babel-preset-env.,https://github.com/eslint/eslint/pull/9460
eslint/eslint,9442,kraigh,Update: add never option to quote-props rule,https://github.com/eslint/eslint/pull/9442
eslint/eslint,9430,kentcdodds,fix(ignore-path): resolve paths relative to cwd,https://github.com/eslint/eslint/pull/9430
eslint/eslint,9408,mgol,Docs: fix checkboxes in the pull request template,https://github.com/eslint/eslint/pull/9408
eslint/eslint,9396,aladdin-add,New: add --fix to no-console.,https://github.com/eslint/eslint/pull/9396
eslint/eslint,9391,VictorHom,New: add consistent option to array-bracket-newline rule (fixes #9136),https://github.com/eslint/eslint/pull/9391
eslint/eslint,9388,mgol,Chore: add a Git .mailmap with my new name,https://github.com/eslint/eslint/pull/9388
eslint/eslint,9378,eran-nussbaum,Fix typo "but" --> "by",https://github.com/eslint/eslint/pull/9378
eslint/eslint,9377,VictorHom,Docs: write about the home dir case eslint config (fixes #7729),https://github.com/eslint/eslint/pull/9377
eslint/eslint,9372,aladdin-add,Fix: id-match mysteriously fails when defined in a comment. (fixes #9…,https://github.com/eslint/eslint/pull/9372
eslint/eslint,9360,ismail-syed,Fix: Check that node.body is defined,https://github.com/eslint/eslint/pull/9360
eslint/eslint,9347,kaicataldo,Update: consecutive option for one-var (fixes #4680),https://github.com/eslint/eslint/pull/9347
eslint/eslint,9320,VictorHom,Fix: remove dupe error message in bin/eslint (fixes #8964),https://github.com/eslint/eslint/pull/9320
eslint/eslint,9317,mysticatea,Proposal: `context.version`,https://github.com/eslint/eslint/pull/9317
eslint/eslint,9316,aladdin-add,Fix: allow "@" in  comment configs.,https://github.com/eslint/eslint/pull/9316
eslint/eslint,9284,VictorHom,(WIP) Chore: Release make file tests (fixes #8489),https://github.com/eslint/eslint/pull/9284
eslint/eslint,9281,aladdin-add,Chore: reorder conditions in if statement.,https://github.com/eslint/eslint/pull/9281
eslint/eslint,9280,aladdin-add,WIP: Chore: use regex.exec() for a small perf gain.,https://github.com/eslint/eslint/pull/9280
eslint/eslint,9244,pmcelhaney,Update: object-curly-spacing spaceInEmptyObject option (fixes #7927),https://github.com/eslint/eslint/pull/9244
eslint/eslint,9226,kevinoid,Fix: parsing YAML .eslintrc with JS-like comments,https://github.com/eslint/eslint/pull/9226
eslint/eslint,9212,gyandeeps,Chore: Move github related files to .github folder,https://github.com/eslint/eslint/pull/9212
eslint/eslint,9181,aladdin-add,Chore: add eslint-plugin-security to detect security issues.,https://github.com/eslint/eslint/pull/9181
eslint/eslint,9180,bmeck,new rule: no restricted export names,https://github.com/eslint/eslint/pull/9180
eslint/eslint,9163,not-an-aardvark,Chore: use eslint-plugin-local instead of --rulesdir for self-linting,https://github.com/eslint/eslint/pull/9163
eslint/eslint,9145,EmmanuelDemey,Add framework option in the config initializer,https://github.com/eslint/eslint/pull/9145
eslint/eslint,9134,avimar,Docs: \n escaping exclusion for quotes,https://github.com/eslint/eslint/pull/9134
eslint/eslint,9132,Standard8,Fix: handle es6 class extensions in new-parens.,https://github.com/eslint/eslint/pull/9132
eslint/eslint,9131,edwardkenfox,Update: make camelcase rule fixable,https://github.com/eslint/eslint/pull/9131
eslint/eslint,9119,CompuIves,Update: Allow parsers to be defined as object,https://github.com/eslint/eslint/pull/9119
eslint/eslint,9117,burka,Test-Case: no-unused-vars broken for isHidden function.,https://github.com/eslint/eslint/pull/9117
eslint/eslint,9084,platinumazure,Fix: no-unreachable reporting EmptyStatements (fixes #9081),https://github.com/eslint/eslint/pull/9084
eslint/eslint,9055,aladdin-add,Chore: add indent in .eslintrc.yml,https://github.com/eslint/eslint/pull/9055
eslint/eslint,9023,tinovyatkin,Fix: Add `yarn` support to `eslint --init`,https://github.com/eslint/eslint/pull/9023
eslint/eslint,8994,VictorHom,Fix: handle array-destructuring with obj assignment in prefer const,https://github.com/eslint/eslint/pull/8994
eslint/eslint,8993,canac,Docs: Access parseInt property correctly,https://github.com/eslint/eslint/pull/8993
eslint/eslint,8975,sauyon,New: Allow decimal arguments to indent's VariableDeclarator (fixes #3339),https://github.com/eslint/eslint/pull/8975
eslint/eslint,8961,aladdin-add,Update: rule no-console should ignore assignment.,https://github.com/eslint/eslint/pull/8961
eslint/eslint,8958,tyomitch,Update: check semicolons in ClassProperty nodes, too,https://github.com/eslint/eslint/pull/8958
eslint/eslint,8866,aladdin-add,Update: rename getter-return's option property,https://github.com/eslint/eslint/pull/8866
eslint/eslint,8855,aladdin-add,Chore: upgrade eslint-plugin-eslint-plugin@0.7.3,https://github.com/eslint/eslint/pull/8855
eslint/eslint,8840,kaicataldo,Fix: EmptyStatements in padding-line-between-statements (fixes #8839),https://github.com/eslint/eslint/pull/8840
eslint/eslint,8833,samdec11,Docs: Correct links in user-guide README,https://github.com/eslint/eslint/pull/8833
eslint/eslint,8780,qfox,Update: Allow eslint-disable-line to be wrapper in BlockComment,https://github.com/eslint/eslint/pull/8780
eslint/eslint,8779,qfox,Fix: max-len and eslint-disable,https://github.com/eslint/eslint/pull/8779
eslint/eslint,8774,aladdin-add,testing: Movlkmann/master,https://github.com/eslint/eslint/pull/8774
eslint/eslint,8772,aladdin-add,Space infix opts,https://github.com/eslint/eslint/pull/8772
eslint/eslint,8731,drugan,New: Override configFile entries by localConfigFile having "root": true,https://github.com/eslint/eslint/pull/8731
eslint/eslint,8716,jbeezley,Update: Add new regex matching rules for valid-jsdoc,https://github.com/eslint/eslint/pull/8716
eslint/eslint,8714,Slamdunk,Chore: indent bug proof to allow block relative disable [regression],https://github.com/eslint/eslint/pull/8714
eslint/eslint,8711,mysticatea,Fix: set indent level to return/throw argument (fixes #8710),https://github.com/eslint/eslint/pull/8711
eslint/eslint,8699,platinumazure,Fix: eslint --quiet no longer fixes warnings (fixes #8675),https://github.com/eslint/eslint/pull/8699
eslint/eslint,8677,sp00m,New: rule no-greater-than,https://github.com/eslint/eslint/pull/8677
eslint/eslint,8671,LouisBrunner,Update: curly-spacing replaces object-curly-spacing (refs #7361),https://github.com/eslint/eslint/pull/8671
eslint/eslint,8667,Lobstrosity,Update: Add multiline-expression statement type,https://github.com/eslint/eslint/pull/8667
eslint/eslint,8664,aladdin-add,Update default.yml: no-debugger: "error",https://github.com/eslint/eslint/pull/8664
eslint/eslint,8663,twolfson,Update: added node type based support to `space-before-function-paren`,https://github.com/eslint/eslint/pull/8663
eslint/eslint,8658,nemoxps,New: ClassDeclaration and ClassExpression option for the indent rule (fix #8230),https://github.com/eslint/eslint/pull/8658
eslint/eslint,8620,sholladay,New: Native linebreak-style option (fixes #8596),https://github.com/eslint/eslint/pull/8620
eslint/eslint,8615,borilla,Update: Comments as blank lines in padding-line-between-statements rule,https://github.com/eslint/eslint/pull/8615
eslint/eslint,8605,mpal9000,Update: Ability to load plugins by path,https://github.com/eslint/eslint/pull/8605
eslint/eslint,8599,borilla,Update: Allow comments to be treated as empty lines in newline-before-return rule,https://github.com/eslint/eslint/pull/8599
eslint/eslint,8598,not-an-aardvark,Chore: make eslintbot look at the PR title, not the first commit message,https://github.com/eslint/eslint/pull/8598
eslint/eslint,8589,milesj,Support an "eslint" property for package.json configuration,https://github.com/eslint/eslint/pull/8589
eslint/eslint,8585,Telokis,Added a way to not document return statement if it matches a pattern,https://github.com/eslint/eslint/pull/8585
eslint/eslint,8582,soda0289,New: Allow parsers to supply Visitor Keys/Fallback (fixes #8392),https://github.com/eslint/eslint/pull/8582
eslint/eslint,8574,YounGoat,Update: Add desc for valid/invalid in RuleTester,https://github.com/eslint/eslint/pull/8574
eslint/eslint,8573,YounGoat,Update: Add desc for valid/invalid in RuleTester,https://github.com/eslint/eslint/pull/8573
eslint/eslint,8571,not-an-aardvark,Chore: remove concat-stream dependency,https://github.com/eslint/eslint/pull/8571
eslint/eslint,8558,ethanresnick,no-undef: don't flag guarded variable uses,https://github.com/eslint/eslint/pull/8558
eslint/eslint,8536,villesau,Fix: 7451, Check existence of range,https://github.com/eslint/eslint/pull/8536
eslint/eslint,8530,not-an-aardvark,Chore: enable linebreak-style on ESLint codebase,https://github.com/eslint/eslint/pull/8530
eslint/eslint,8529,vitorbal,Fix: handle destructuring with defaults in camelcase rule (fixes #8511),https://github.com/eslint/eslint/pull/8529
eslint/eslint,8525,aladdin-add,Update default.yml, turn off comma-dangle,https://github.com/eslint/eslint/pull/8525
eslint/eslint,8523,not-an-aardvark,Chore: enable no-negated-condition on ESLint codebase,https://github.com/eslint/eslint/pull/8523
eslint/eslint,8515,edmorley,Breaking: Add .jsx to the default --ext file extensions (fixes #8399),https://github.com/eslint/eslint/pull/8515
eslint/eslint,8487,freshp86,Fix: Preserve comment tokens in object-curly-newline fix().,https://github.com/eslint/eslint/pull/8487
eslint/eslint,8480,xgqfrms-GitHub,typo,https://github.com/eslint/eslint/pull/8480
eslint/eslint,8456,vkhv,compact syntax,https://github.com/eslint/eslint/pull/8456
eslint/eslint,8409,EnTeQuAk,Update: Report identifiers that are assigned strings in no-implied-eval.,https://github.com/eslint/eslint/pull/8409
eslint/eslint,8407,jameswomack,Support controlling template string spaces in fix output and warnings/errors,https://github.com/eslint/eslint/pull/8407
eslint/eslint,8389,soda0289,Breaking: Traverse into decorators,https://github.com/eslint/eslint/pull/8389
eslint/eslint,8382,not-an-aardvark,Chore: simplify eslint:recommended generation (fixes #8370),https://github.com/eslint/eslint/pull/8382
eslint/eslint,8369,MatthewHerbst,Bug fix: check descriptor.node.loc existence,https://github.com/eslint/eslint/pull/8369
eslint/eslint,8343,justinanastos,Add Import/Export Declaration checks to `indent`,https://github.com/eslint/eslint/pull/8343
eslint/eslint,8333,fnwiya,Update: Add ignoredStrings option to camelcase,https://github.com/eslint/eslint/pull/8333
eslint/eslint,8322,not-an-aardvark,Chore: remove unused files from .gitignore,https://github.com/eslint/eslint/pull/8322
eslint/eslint,8317,marocchino,Docs: Minor fix,https://github.com/eslint/eslint/pull/8317
eslint/eslint,8309,nemoxps,New: padded-blocks implicit blocks,https://github.com/eslint/eslint/pull/8309
eslint/eslint,8291,alberto,Fix: nested config env should override parent parserOptions,https://github.com/eslint/eslint/pull/8291
eslint/eslint,8272,doug-wade,Add failing unit test,https://github.com/eslint/eslint/pull/8272
eslint/eslint,8257,JPeer264,Docs: fix links,https://github.com/eslint/eslint/pull/8257
eslint/eslint,8219,clambodile,Fix link typos in user-guide/README.md,https://github.com/eslint/eslint/pull/8219
eslint/eslint,8212,bolinfest,Introduce a no-java-constructor rule.,https://github.com/eslint/eslint/pull/8212
eslint/eslint,8204,alberto,Breaking: `RuleTester` ensures tests in fixable rules define `output`,https://github.com/eslint/eslint/pull/8204
eslint/eslint,8200,jwilk,Docs: fix typos,https://github.com/eslint/eslint/pull/8200
eslint/eslint,8167,jfo84,Update: Add fixer for prefer-destructuring,https://github.com/eslint/eslint/pull/8167
eslint/eslint,8165,camcam1993,Indent rewrite,https://github.com/eslint/eslint/pull/8165
eslint/eslint,8145,mysticatea,Fix: invalid autofix of padded-blocks (refs #8117),https://github.com/eslint/eslint/pull/8145
eslint/eslint,8128,InsightLive,Add rule category and description to messages in cli result,https://github.com/eslint/eslint/pull/8128
eslint/eslint,8123,Gvozd,Fix: `sourceCode.getJSDocComment` should work with decorated classes/methods,https://github.com/eslint/eslint/pull/8123
eslint/eslint,8122,alberto,Update: add `backtick` to `--init` (fixes #7997),https://github.com/eslint/eslint/pull/8122
eslint/eslint,8105,evnp,New: Add "exceptions" option to space-infix-ops,https://github.com/eslint/eslint/pull/8105
eslint/eslint,8060,Corvimae,Update: Add `ignoreComments` option to `no-trailing-spaces`,https://github.com/eslint/eslint/pull/8060
eslint/eslint,8057,Corvimae,Update: Add `ignoreComments` option to `no-trailing-spaces`,https://github.com/eslint/eslint/pull/8057
eslint/eslint,8017,ilyavolodin,Docs: Move @not-an-aardvark to TSC,https://github.com/eslint/eslint/pull/8017
eslint/eslint,8008,kentcdodds,fix(indent): --fix will not fix indentation with tabs of JSX.,https://github.com/eslint/eslint/pull/8008
eslint/eslint,7995,not-an-aardvark,Fix: no-use-before-define false positive with exports (fixes #7858),https://github.com/eslint/eslint/pull/7995
eslint/eslint,7989,vitorbal,New: Add no-array-destructured-return rule (fixes #6054),https://github.com/eslint/eslint/pull/7989
eslint/eslint,7982,paul-barry-kenzan,Fix #7967: Handle globals config usage,https://github.com/eslint/eslint/pull/7982
eslint/eslint,7969,wtgtybhertgeghgtwtg,Bump `inquirer`.,https://github.com/eslint/eslint/pull/7969
eslint/eslint,7954,terrierscript,Update: Add semi-spacing fixer for semicolon only line ,https://github.com/eslint/eslint/pull/7954
eslint/eslint,7930,flowmemo,Fix: `no-extra-semi` should not remove necessary semicolon (fixes #79…,https://github.com/eslint/eslint/pull/7930
eslint/eslint,7915,GabrielDelepine,Fix: Correct typos in configuring.md,https://github.com/eslint/eslint/pull/7915
eslint/eslint,7902,stewx,New Rule: no-chained-assignments,https://github.com/eslint/eslint/pull/7902
eslint/eslint,7899,vedatmahir,Chore: glob.js file updated to ES6 classes (refs #7849),https://github.com/eslint/eslint/pull/7899
eslint/eslint,7867,orta,[WIP] Update: Adds the ability to scope require-jsdoc to exported properties,https://github.com/eslint/eslint/pull/7867
eslint/eslint,7848,kaicataldo,Chore: refactor lib/config to ES6 class,https://github.com/eslint/eslint/pull/7848
eslint/eslint,7824,trevorsmith,Update: add `detectDefaultValues` to `no-magic-numbers` (fixes #5672),https://github.com/eslint/eslint/pull/7824
eslint/eslint,7823,anaisbetts,Add new "consistent" option for linebreak-style,https://github.com/eslint/eslint/pull/7823
eslint/eslint,7822,not-an-aardvark,Update: Allow query selectors as options for no-restricted-syntax,https://github.com/eslint/eslint/pull/7822
eslint/eslint,7819,itavy,Fix: check require-jsdoc for FunctionExpression by let and const,https://github.com/eslint/eslint/pull/7819
eslint/eslint,7815,FezVrasta,Add support for DOTFILES_PATH environment variable,https://github.com/eslint/eslint/pull/7815
eslint/eslint,7800,Scrum,feat(config-file): add alternative property name for config,https://github.com/eslint/eslint/pull/7800
eslint/eslint,7777,not-an-aardvark,Update: fix no-useless-escape false negative with braces (fixes #7772),https://github.com/eslint/eslint/pull/7777
eslint/eslint,7768,app,Fix: Fix broken links in documentation,https://github.com/eslint/eslint/pull/7768
eslint/eslint,7753,jonathantneal,Fix: patch projectPath resolve when still in node_modules directory,https://github.com/eslint/eslint/pull/7753
eslint/eslint,7738,wtgtybhertgeghgtwtg,Drop `user-home`.,https://github.com/eslint/eslint/pull/7738
eslint/eslint,7721,mklopets,Fix edge case for reporter when number of problems is 99,https://github.com/eslint/eslint/pull/7721
eslint/eslint,7715,gajus,Make sort-keys fixable (fixes #7714) [WIP],https://github.com/eslint/eslint/pull/7715
eslint/eslint,7713,mroderick,New: `no-boolean-trap` rule,https://github.com/eslint/eslint/pull/7713
eslint/eslint,7708,zackargyle,Update: Add support for flow type import/export declarations,https://github.com/eslint/eslint/pull/7708
eslint/eslint,7704,okonet,Lint staged,https://github.com/eslint/eslint/pull/7704
eslint/eslint,7680,CurtisHumphrey,Update: comma-dangle.md,https://github.com/eslint/eslint/pull/7680
eslint/eslint,7674,jonnyarnold,Added string-match rule.,https://github.com/eslint/eslint/pull/7674
eslint/eslint,7640,ForbesLindesay,Test output even if errors is just a number,https://github.com/eslint/eslint/pull/7640
eslint/eslint,7639,thepian,enableTypeSort,https://github.com/eslint/eslint/pull/7639
eslint/eslint,7623,platinumazure,Update: Show stack trace when plugin is missing,https://github.com/eslint/eslint/pull/7623
eslint/eslint,7602,edg2s,Update: Add `allowChainable` option to `valid-jsdoc` (Fixes #6681),https://github.com/eslint/eslint/pull/7602
eslint/eslint,7591,mvolkmann,Update: added operator-specific options to space-infix-ops rule,https://github.com/eslint/eslint/pull/7591
eslint/eslint,7529,gyandeeps,Chore: Require jsdoc for arrow functions,https://github.com/eslint/eslint/pull/7529
eslint/eslint,7520,graingert,fix: rule-proposal + PR tempalte markdown checkboxes,https://github.com/eslint/eslint/pull/7520
eslint/eslint,7514,eelyafi,Fix: Adds autofixer for no-plusplus rule. (fixes: #7505),https://github.com/eslint/eslint/pull/7514
eslint/eslint,7513,gyandeeps,Chore: Only build PR and not branches,https://github.com/eslint/eslint/pull/7513
eslint/eslint,7511,ilyavolodin,WIP: Autofixing in processors,https://github.com/eslint/eslint/pull/7511
eslint/eslint,7486,not-an-aardvark,Upgrade: mock-fs to ^3.12.0,https://github.com/eslint/eslint/pull/7486
eslint/eslint,7455,not-an-aardvark,Update: WIP: add `ignoreCharClasses` option for `no-useless-escape`,https://github.com/eslint/eslint/pull/7455
eslint/eslint,7430,platinumazure,New: RuleTester supports grouping tests into scenarios,https://github.com/eslint/eslint/pull/7430
eslint/eslint,7417,taion,Update: Handle ForAwaitStatement in semi,https://github.com/eslint/eslint/pull/7417
eslint/eslint,7416,pfhayes,New: Inform when fixes were applied,https://github.com/eslint/eslint/pull/7416
eslint/eslint,7395,mysticatea,Breaking: report file not found errors (fixes #7390),https://github.com/eslint/eslint/pull/7395
