eslint/eslint,7381,jokeyrhyme,Update: recommend no-process-exit rule per Node.js,https://github.com/eslint/eslint/pull/7381
eslint/eslint,7379,SimenB,Update: add fixer for `no-useless-escape`,https://github.com/eslint/eslint/pull/7379
eslint/eslint,7378,SimenB,Chore: Cache `node_modules` on travis,https://github.com/eslint/eslint/pull/7378
eslint/eslint,7345,SimenB,[WIP] Extract file utils into a separate package,https://github.com/eslint/eslint/pull/7345
eslint/eslint,7336,SimenB,Add a test case which fails for autofixing `prefer-const`,https://github.com/eslint/eslint/pull/7336
eslint/eslint,7301,amilajack,Update: Run appveyor tests against travis node versions,https://github.com/eslint/eslint/pull/7301
eslint/eslint,7300,amilajack,Fix: Run appveyor tests against travis node versions,https://github.com/eslint/eslint/pull/7300
eslint/eslint,7261,Moeriki,Update report messages to include function name,https://github.com/eslint/eslint/pull/7261
eslint/eslint,7246,sunkibaek,Fix doc to reflect real behavior,https://github.com/eslint/eslint/pull/7246
eslint/eslint,7241,sadovnik,Chore: codestyle fix,https://github.com/eslint/eslint/pull/7241
eslint/eslint,7203,arxpoetica,Add `skipCommentMatch` (see note),https://github.com/eslint/eslint/pull/7203
eslint/eslint,7188,not-an-aardvark,Update: add fixer for `no-useless-escape`,https://github.com/eslint/eslint/pull/7188
eslint/eslint,7177,CrabDude,New: Add `overrides` and `files` configuration options (refs #3611),https://github.com/eslint/eslint/pull/7177
eslint/eslint,7171,dwhieb,Fix: use Reflect.ownKeys in prefer-reflect (fixes #7075),https://github.com/eslint/eslint/pull/7171
eslint/eslint,7160,clickthisnick,Chore throw if no test scenarios,https://github.com/eslint/eslint/pull/7160
eslint/eslint,7140,kdex,Fix: Report columns for `eol-last` correctly (fixes #7136),https://github.com/eslint/eslint/pull/7140
eslint/eslint,7133,sethkinast,Update: `prefer-rest-params` relax for spread (fixes #7130),https://github.com/eslint/eslint/pull/7133
eslint/eslint,7119,dwhieb,Fix: use Reflect.ownKeys in prefer-reflect rule (fixes #7075),https://github.com/eslint/eslint/pull/7119
eslint/eslint,7093,dallonf,Docs: Elaborate on best practice for `hasOwnProperty`,https://github.com/eslint/eslint/pull/7093
eslint/eslint,7073,joekrill,New: Add `excludes` and `includes` configuration options (refs #3611),https://github.com/eslint/eslint/pull/7073
eslint/eslint,7068,mgedmin,Missing arguments in examples,https://github.com/eslint/eslint/pull/7068
eslint/eslint,7066,jrsearles,New: add individual options for `brace-style` (fixes #6828),https://github.com/eslint/eslint/pull/7066
eslint/eslint,7055,kaicataldo,Chore: enable prefer-template rule (refs #6407),https://github.com/eslint/eslint/pull/7055
eslint/eslint,7034,jacobp100,Add airbnb-base to eslint config (closes #6986),https://github.com/eslint/eslint/pull/7034
eslint/eslint,7032,Thoro,Update: Added disallowMultipleSpaces option to the space-before-block…,https://github.com/eslint/eslint/pull/7032
eslint/eslint,7026,jankuca,add allowCommentBody option to no-fallthrough,https://github.com/eslint/eslint/pull/7026
eslint/eslint,7009,paladox,Also run npm install in travis ci,https://github.com/eslint/eslint/pull/7009
eslint/eslint,6987,robertrossmann,Update: Make `no-tabs` rule fixable,https://github.com/eslint/eslint/pull/6987
eslint/eslint,6951,Cellule,Shareable plugins,https://github.com/eslint/eslint/pull/6951
